{
  "mode": "break-architecture",
  "title": "Decouple the web tier from the workers",
  "explanation": "An SQS queue buffers work between the web tier and the worker fleet, so a traffic spike or a slow worker can't overwhelm the app — workers pull messages at their own pace and Auto Scaling tracks queue depth.",
  "data": {
    "diagramFormat": "ascii",
    "diagram": "   [ ALB ]\n      |\n      v\n  [ Web EC2 ]\n      |\n      v\n  [ __MASK__ ]   <-- pick this\n      |\n      v\n  [ Worker EC2 ]  (Auto Scaling)\n      |\n      v\n  [ DynamoDB ]\n",
    "maskedToken": "__MASK__",
    "choices": [
      "Amazon SQS",
      "Amazon SNS",
      "Amazon Kinesis Data Firehose",
      "AWS Step Functions"
    ],
    "correctIndex": 0
  }
}
