{
  "mode": "scenario-builder",
  "title": "Ship a container to GKE",
  "explanation": "Cloud Build builds the container image, the image is pushed to Artifact Registry, deployed to Google Kubernetes Engine, and exposed to users via Cloud Load Balancing.",
  "data": {
    "scenario": "Take source code to a globally reachable containerized service on Google Cloud. Order the stages.",
    "pool": [
      "Cloud Build",
      "Artifact Registry",
      "Google Kubernetes Engine",
      "Cloud Load Balancing",
      "Cloud Storage",
      "Compute Engine"
    ],
    "correctOrder": [
      "Cloud Build",
      "Artifact Registry",
      "Google Kubernetes Engine",
      "Cloud Load Balancing"
    ]
  }
}
