{
  "mode": "scenario-builder",
  "title": "Order the incident response lifecycle",
  "explanation": "The incident response process runs Preparation -> Identification -> Containment -> Eradication -> Recovery -> Lessons Learned. Containment always comes before eradication, and lessons learned closes the loop so you improve before the next incident.",
  "data": {
    "scenario": "Put the incident response phases in order, from before an incident occurs through closing it out.",
    "pool": [
      "Preparation",
      "Identification",
      "Containment",
      "Eradication",
      "Recovery",
      "Lessons Learned",
      "Disclosure"
    ],
    "correctOrder": [
      "Preparation",
      "Identification",
      "Containment",
      "Eradication",
      "Recovery",
      "Lessons Learned"
    ]
  }
}
