{
  "mode": "scenario-builder",
  "title": "Build a serverless image-upload pipeline",
  "explanation": "Uploads land in S3 → S3 event triggers Lambda → Lambda reads the image, calls Rekognition, writes a thumbnail back to S3 and metadata to DynamoDB.",
  "data": {
    "scenario": "Users upload product photos via a static site. Generate a thumbnail and detect inappropriate content. No servers to manage.",
    "pool": [
      "Amazon S3 (uploads bucket)",
      "AWS Lambda",
      "Amazon Rekognition",
      "Amazon DynamoDB",
      "Amazon EC2 Auto Scaling",
      "Amazon RDS",
      "Amazon SQS"
    ],
    "correctOrder": [
      "Amazon S3 (uploads bucket)",
      "AWS Lambda",
      "Amazon Rekognition",
      "Amazon DynamoDB"
    ]
  }
}
