{
  "mode": "break-architecture",
  "title": "What fronts the EC2 fleet?",
  "explanation": "An Application Load Balancer distributes incoming traffic across EC2 instances in multiple Availability Zones and routes around unhealthy ones.",
  "data": {
    "diagramFormat": "ascii",
    "diagram": "      Users\n        |\n        v\n  [ Route 53 ]\n        |\n        v\n  [ __MASK__ ]   <-- pick this\n        |\n      .-+-.\n      v   v\n   [EC2] [EC2]   (Auto Scaling, multi-AZ)\n        |\n        v\n  [ RDS Multi-AZ ]\n",
    "maskedToken": "__MASK__",
    "choices": [
      "Application Load Balancer",
      "Amazon S3",
      "Amazon CloudFront",
      "AWS Direct Connect"
    ],
    "correctIndex": 0
  }
}
