{
  "mode": "scenario-builder",
  "title": "Order the Cyber Kill Chain",
  "explanation": "Lockheed Martin's Cyber Kill Chain models an intrusion: Reconnaissance, Weaponization, Delivery, Exploitation, Installation, Command and Control, then Actions on Objectives. Breaking any link disrupts the attack.",
  "data": {
    "scenario": "Map an intrusion to the Cyber Kill Chain. Put the phases in order.",
    "pool": [
      "Reconnaissance",
      "Weaponization",
      "Delivery",
      "Exploitation",
      "Installation",
      "Command and Control",
      "Actions on Objectives",
      "Attribution"
    ],
    "correctOrder": [
      "Reconnaissance",
      "Weaponization",
      "Delivery",
      "Exploitation",
      "Installation",
      "Command and Control",
      "Actions on Objectives"
    ]
  }
}
