{
  "mode": "break-architecture",
  "title": "Connect many VPCs and on-prem at scale",
  "explanation": "A Transit Gateway is a hub that connects many VPCs and on-premises networks with one attachment each. Full-mesh VPC peering doesn't scale, an internet gateway is just internet egress, and Direct Connect is only the physical on-prem link.",
  "data": {
    "diagramFormat": "ascii",
    "diagram": "  [VPC A]  [VPC B]  [On-prem VPN]\n      |       |          |\n      +-------+----------+\n              |\n        [ __MASK__ ]   <-- pick this\n",
    "maskedToken": "__MASK__",
    "choices": [
      "Transit Gateway",
      "VPC peering",
      "Internet Gateway",
      "Direct Connect"
    ],
    "correctIndex": 0
  }
}
