{
  "mode": "scenario-builder",
  "title": "Order the Azure scope hierarchy",
  "explanation": "Azure organizes resources top-down: management groups contain subscriptions, subscriptions contain resource groups, and resource groups contain resources. Azure Policy and RBAC assigned higher up are inherited downward.",
  "data": {
    "scenario": "Arrange the four Azure management scopes from broadest (top) to narrowest — the way governance and RBAC inheritance flows.",
    "pool": [
      "Management group",
      "Subscription",
      "Resource group",
      "Resource",
      "Resource provider",
      "Region"
    ],
    "correctOrder": [
      "Management group",
      "Subscription",
      "Resource group",
      "Resource"
    ]
  }
}
