{
  "mode": "break-architecture",
  "title": "Route users to the nearest region",
  "explanation": "Google Cloud's global external load balancer uses a single anycast IP to route each user to the nearest healthy backend region. Cloud NAT is egress, Interconnect is on-prem connectivity, and Cloud Armor is WAF/DDoS protection.",
  "data": {
    "diagramFormat": "ascii",
    "diagram": "    Users (global)\n          |\n    [ __MASK__ ]   <-- single anycast IP\n          |\n     +----+----+\n     |         |\n [region A] [region B]\n",
    "maskedToken": "__MASK__",
    "choices": [
      "Cloud Load Balancing (global)",
      "Cloud NAT",
      "Cloud Interconnect",
      "Cloud Armor"
    ],
    "correctIndex": 0
  }
}
