{
  "mode": "match-pair",
  "title": "AWS storage services",
  "explanation": "Object storage for unstructured data lives on S3; block storage for EC2 lives on EBS; managed file storage that scales with usage is EFS; archival cold storage is S3 Glacier.",
  "data": {
    "pairs": [
      { "left": "Unstructured object storage at internet scale",       "right": "Amazon S3" },
      { "left": "Network-attached block storage for an EC2 instance",  "right": "Amazon EBS" },
      { "left": "Elastic file share mountable from many EC2 instances", "right": "Amazon EFS" },
      { "left": "Long-term archival, retrieval in minutes-to-hours",   "right": "S3 Glacier" }
    ]
  }
}
