{
  "mode": "scenario-builder",
  "title": "Host a static website on AWS",
  "explanation": "Store the files in S3, serve them globally over HTTPS through CloudFront, then point your custom domain at the distribution with Route 53.",
  "data": {
    "scenario": "You have a folder of static HTML/CSS/JS. Serve it worldwide over HTTPS on your own domain, with no servers to manage.",
    "pool": [
      "Amazon S3 (host the files)",
      "Amazon CloudFront (CDN + HTTPS)",
      "Amazon Route 53 (custom domain)",
      "Amazon EC2",
      "Amazon RDS",
      "AWS Lambda"
    ],
    "correctOrder": [
      "Amazon S3 (host the files)",
      "Amazon CloudFront (CDN + HTTPS)",
      "Amazon Route 53 (custom domain)"
    ]
  }
}
