{
  "mode": "scenario-builder",
  "title": "Order the GCP resource hierarchy",
  "explanation": "Google Cloud nests resources: the Organization is the root, Folders group projects, Projects hold the actual resources. IAM policies set higher up are inherited downward.",
  "data": {
    "scenario": "Arrange the GCP resource hierarchy from the root (top) down to where resources live.",
    "pool": [
      "Organization",
      "Folder",
      "Project",
      "Resource",
      "Billing account",
      "Region"
    ],
    "correctOrder": [
      "Organization",
      "Folder",
      "Project",
      "Resource"
    ]
  }
}
