{
  "mode": "scenario-builder",
  "title": "Order the data security lifecycle",
  "explanation": "CISSP's data lifecycle runs Create, Store, Use, Share, Archive, Destroy. Controls like classification, encryption, DLP, and retention apply at the appropriate phase.",
  "data": {
    "scenario": "Track a piece of sensitive data from creation to disposal. Order the lifecycle phases.",
    "pool": [
      "Create",
      "Store",
      "Use",
      "Share",
      "Archive",
      "Destroy",
      "Backup"
    ],
    "correctOrder": [
      "Create",
      "Store",
      "Use",
      "Share",
      "Archive",
      "Destroy"
    ]
  }
}
