{
  "mode": "break-architecture",
  "title": "What connects the LAN to the internet?",
  "explanation": "A router forwards packets between networks (the LAN and the ISP/WAN) and is the default gateway out to the internet. A switch only moves frames within the LAN.",
  "data": {
    "diagramFormat": "ascii",
    "diagram": "  [ PC ]\n     |\n  [ Switch ]\n     |\n  [ __MASK__ ]   <-- pick this\n     |\n  [ Internet ]\n",
    "maskedToken": "__MASK__",
    "choices": [
      "Router",
      "Network hub",
      "Repeater",
      "Wireless access point"
    ],
    "correctIndex": 0
  }
}
