{
  "mode": "scenario-builder",
  "title": "How the API server vets a request",
  "explanation": "Every request to the kube-apiserver is checked in order: authenticate the identity, authorize it via RBAC, run admission controllers (mutating then validating), and finally persist the object to etcd.",
  "data": {
    "scenario": "A user runs kubectl apply. Order the security checks the API server applies before the object is stored.",
    "pool": [
      "Authentication",
      "Authorization (RBAC)",
      "Admission control",
      "Persist to etcd",
      "Network policy",
      "Audit logging"
    ],
    "correctOrder": [
      "Authentication",
      "Authorization (RBAC)",
      "Admission control",
      "Persist to etcd"
    ]
  }
}
