{
  "mode": "scenario-builder",
  "title": "Build a CI/CD pipeline on AWS",
  "explanation": "AWS CodePipeline orchestrates the stages: CodeCommit hosts the source repo, CodeBuild compiles and tests, and CodeDeploy rolls the build out to the targets.",
  "data": {
    "scenario": "Commit code, build and test it, then deploy. Order the AWS developer-tools stages.",
    "pool": [
      "AWS CodeCommit",
      "AWS CodeBuild",
      "AWS CodeDeploy",
      "AWS CodeArtifact",
      "AWS CloudFormation",
      "Amazon CodeGuru"
    ],
    "correctOrder": [
      "AWS CodeCommit",
      "AWS CodeBuild",
      "AWS CodeDeploy"
    ]
  }
}
